{
  "$schema": "https://json-schema.org/draft/2020-12/schema",
  "title": "CAIR Gold Intent State",
  "type": "object",
  "required": [
    "task_id",
    "issue_type",
    "symptom",
    "expected_behavior",
    "observed_behavior"
  ],
  "properties": {
    "task_id": {"type": "string"},
    "issue_type": {"type": "string"},
    "symptom": {"type": "string"},
    "expected_behavior": {"type": "string"},
    "observed_behavior": {"type": "string"},
    "reproduction": {"type": "string"},
    "constraints": {"type": "array", "items": {"type": "string"}},
    "non_goals": {"type": "array", "items": {"type": "string"}},
    "relevant_files": {"type": "array", "items": {"type": "string"}},
    "success_tests": {"type": "array", "items": {"type": "string"}},
    "misleading_traps": {"type": "array", "items": {"type": "string"}},
    "evidence": {"type": "object"}
  }
}
