{
  "task_id": "sqlfluff__sqlfluff-2862",
  "issue_type": "feature",
  "symptom": "fix keep adding new line on wrong place",
  "expected_behavior": "The expected behavior would be to add the new line at the end of the file, that is after `{%- endif %}` instead of adding the new line at the end of the SQL query - so the result should look like this: \n\n```\n{% if true %}\nSELECT 1 + 1\n{%- endif %}\n\n```",
  "observed_behavior": "Adds a new line to the end of the SQL query instead of in the end of the file.",
  "reproduction": "Already mentioned above (in What Happened section).",
  "constraints": [
    "The fix must resolve all FAIL_TO_PASS tests.",
    "The fix must not regress PASS_TO_PASS tests.",
    "The agent should not modify tests to hide the failure.",
    "Evaluation tests are applied after the model patch."
  ],
  "non_goals": [
    "Do not apply the gold patch directly during evaluation.",
    "Do not rely on the hidden test patch as agent-visible context."
  ],
  "relevant_files": [
    "src/sqlfluff/core/linter/common.py",
    "src/sqlfluff/core/linter/linted_file.py",
    "src/sqlfluff/core/parser/lexer.py",
    "src/sqlfluff/core/parser/segments/base.py",
    "src/sqlfluff/core/rules/base.py",
    "src/sqlfluff/core/templaters/slicers/tracer.py",
    "src/sqlfluff/rules/L009.py"
  ],
  "success_tests": [
    "test/api/simple_test.py::test__api__lint_string",
    "test/core/templaters/jinja_test.py::test__templater_jinja_slice_file[{%",
    "test/core/templaters/jinja_test.py::test__templater_jinja_slice_file[{%-"
  ],
  "misleading_traps": [
    "The initial user request is intentionally incomplete.",
    "User guesses may be incorrect and should be verified against code and tests."
  ],
  "evidence": {
    "gold_patch_files": [
      "src/sqlfluff/core/linter/common.py",
      "src/sqlfluff/core/linter/linted_file.py",
      "src/sqlfluff/core/parser/lexer.py",
      "src/sqlfluff/core/parser/segments/base.py",
      "src/sqlfluff/core/rules/base.py",
      "src/sqlfluff/core/templaters/slicers/tracer.py",
      "src/sqlfluff/rules/L009.py"
    ],
    "test_patch_files": [
      "test/api/simple_test.py",
      "test/core/templaters/jinja_test.py",
      "test/fixtures/rules/std_rule_cases/L009.yml"
    ],
    "fail_to_pass": [
      "test/api/simple_test.py::test__api__lint_string",
      "test/core/templaters/jinja_test.py::test__templater_jinja_slice_file[{%",
      "test/core/templaters/jinja_test.py::test__templater_jinja_slice_file[{%-"
    ],
    "pass_to_pass_count": 60
  }
}
