{
  "task_id": "sqlfluff__sqlfluff-2336",
  "issue_type": "bug",
  "symptom": "L026: Rule incorrectly flag column does not exist in `FROM` clause in an UPDATE statement.",
  "expected_behavior": "L026 should not fail when a subquery in an UPDATE statement references a column from the UPDATE target.",
  "observed_behavior": "L026 failed due to reference was not found in the FROM clause with the following error printed (When using `sample.sql` content below)\n\n```\nL:   7 | P:  28 | L026 | Reference 'my_table.id' refers to table/view not found\n                       | in the FROM clause or found in parent subquery.\n```",
  "reproduction": "1. Create `sample.sql` with the content below\n```\nUPDATE my_table\nSET row_sum = (\n    SELECT COUNT(*) AS row_sum\n    FROM\n        another_table\n    WHERE\n        another_table.id = my_table.id\n);\n```\n2. Run SQLFluff by `sqlfluff lint sample.sql`",
  "constraints": [
    "The fix must resolve all FAIL_TO_PASS tests.",
    "The fix must not regress PASS_TO_PASS tests.",
    "The agent should not modify tests to hide the failure.",
    "Evaluation tests are applied after the model patch."
  ],
  "non_goals": [
    "Do not apply the gold patch directly during evaluation.",
    "Do not rely on the hidden test patch as agent-visible context."
  ],
  "relevant_files": [
    "src/sqlfluff/core/rules/analysis/select.py",
    "src/sqlfluff/core/rules/reference.py",
    "src/sqlfluff/dialects/dialect_ansi.py",
    "src/sqlfluff/dialects/dialect_bigquery.py",
    "src/sqlfluff/rules/L025.py",
    "src/sqlfluff/rules/L026.py"
  ],
  "success_tests": [
    "test/core/rules/reference_test.py::test_object_ref_matches_table[possible_references0-targets0-True]",
    "test/core/rules/reference_test.py::test_object_ref_matches_table[possible_references1-targets1-True]",
    "test/core/rules/reference_test.py::test_object_ref_matches_table[possible_references2-targets2-False]",
    "test/core/rules/reference_test.py::test_object_ref_matches_table[possible_references3-targets3-True]",
    "test/core/rules/reference_test.py::test_object_ref_matches_table[possible_references4-targets4-False]",
    "test/core/rules/reference_test.py::test_object_ref_matches_table[possible_references5-targets5-True]",
    "test/core/rules/reference_test.py::test_object_ref_matches_table[possible_references6-targets6-False]",
    "test/core/rules/reference_test.py::test_object_ref_matches_table[possible_references7-targets7-True]",
    "test/core/rules/reference_test.py::test_object_ref_matches_table[possible_references8-targets8-False]",
    "test/core/rules/reference_test.py::test_object_ref_matches_table[possible_references9-targets9-True]",
    "test/core/rules/reference_test.py::test_object_ref_matches_table[possible_references10-targets10-False]",
    "test/core/rules/reference_test.py::test_object_ref_matches_table[possible_references11-targets11-True]",
    "test/core/rules/reference_test.py::test_object_ref_matches_table[possible_references12-targets12-True]",
    "test/core/rules/reference_test.py::test_object_ref_matches_table[possible_references13-targets13-False]"
  ],
  "misleading_traps": [
    "The initial user request is intentionally incomplete.",
    "User guesses may be incorrect and should be verified against code and tests."
  ],
  "evidence": {
    "gold_patch_files": [
      "src/sqlfluff/core/rules/analysis/select.py",
      "src/sqlfluff/core/rules/reference.py",
      "src/sqlfluff/dialects/dialect_ansi.py",
      "src/sqlfluff/dialects/dialect_bigquery.py",
      "src/sqlfluff/rules/L025.py",
      "src/sqlfluff/rules/L026.py"
    ],
    "test_patch_files": [
      "test/core/rules/reference_test.py",
      "test/fixtures/rules/std_rule_cases/L026.yml"
    ],
    "fail_to_pass": [
      "test/core/rules/reference_test.py::test_object_ref_matches_table[possible_references0-targets0-True]",
      "test/core/rules/reference_test.py::test_object_ref_matches_table[possible_references1-targets1-True]",
      "test/core/rules/reference_test.py::test_object_ref_matches_table[possible_references2-targets2-False]",
      "test/core/rules/reference_test.py::test_object_ref_matches_table[possible_references3-targets3-True]",
      "test/core/rules/reference_test.py::test_object_ref_matches_table[possible_references4-targets4-False]",
      "test/core/rules/reference_test.py::test_object_ref_matches_table[possible_references5-targets5-True]",
      "test/core/rules/reference_test.py::test_object_ref_matches_table[possible_references6-targets6-False]",
      "test/core/rules/reference_test.py::test_object_ref_matches_table[possible_references7-targets7-True]",
      "test/core/rules/reference_test.py::test_object_ref_matches_table[possible_references8-targets8-False]",
      "test/core/rules/reference_test.py::test_object_ref_matches_table[possible_references9-targets9-True]",
      "test/core/rules/reference_test.py::test_object_ref_matches_table[possible_references10-targets10-False]",
      "test/core/rules/reference_test.py::test_object_ref_matches_table[possible_references11-targets11-True]",
      "test/core/rules/reference_test.py::test_object_ref_matches_table[possible_references12-targets12-True]",
      "test/core/rules/reference_test.py::test_object_ref_matches_table[possible_references13-targets13-False]"
    ],
    "pass_to_pass_count": 0
  }
}
